SQL> CREATE TABLE EMPRECORDSSS(ENO NUMBER(3),ENAME VARCHAR(8),ADDRESS VARCHAR(20));

Table created.

SQL> INSERT INTO EmprecordsSS VALUES (1,'LIA','SALEM') ;

1 row created.

SQL> INSERT INTO Emprecordsss VALUES (2,'DISHONA','SALEM') ;

1 row created.

SQL> INSERT INTO Emprecordsss VALUES (3,'SRIMATHI','MADURAI') ;

1 row created.

SQL> INSERT INTO Emprecordsss VALUES (4,'SELVI','MADURAI') ;

1 row created.

SQL> SELECT * FROM Emprecordsss ;

       ENO ENAME    ADDRESS
---------- -------- --------------------
         1 LIA      SALEM
         2 DISHONA  SALEM
         3 SRIMATHI MADURAI
         4 SELVI    MADURAI

SQL> ALTER TABLE Emprecordsss ADD age number (2) ;

Table altered.

SQL> UPDATE Emprecordsss SET age = 18 WHERE address = 'MADURAI' ;

2 rows updated.

SQL> ALTER TABLE Emprecordsss MODIFY ename varchar (30) ;

Table altered.

SQL> SELECT * FROM Emprecordsss ;

       ENO ENAME                          ADDRESS                     AGE
---------- ------------------------------ -------------------- ----------
         1 LIA                            SALEM
         2 DISHONA                        SALEM
         3 SRIMATHI                       MADURAI                      18
         4 SELVI                          MADURAI                      18

SQL> ALTER TABLE Emprecordsss DROP COLUMN age ;

Table altered.